{
  "kind": "cc-work-lock",
  "version": "1.0.0",
  "fingerprint": "0e96958ce5211278",
  "capsuleId": "s3-allergy-readiness",
  "scope": [
    "pipeline/scoring.py",
    "pipeline/test_scoring.py",
    "research/allergen_safety_audit.js",
    "research/verify_run.js",
    "docs/CONTENT-HANDOFF.md",
    "content/operations/reviews/s3-allergy-baseline-2026-07-15.md",
    "content/operations/results/s3-allergy-readiness.md"
  ],
  "events": [
    {
      "action": "acquired",
      "owner": "phase1",
      "at": "2026-07-15T20:39:46.204Z",
      "expiresAt": "2026-07-16T00:39:46.204Z",
      "note": ""
    },
    {
      "action": "released",
      "owner": "phase1",
      "at": "2026-07-15T20:56:21.395Z",
      "expiresAt": null,
      "note": "Data repair verified; publication held for H14 and release-status gates."
    }
  ]
}
